{
  "task_id": "T28-reg",
  "task_type": "memory_query",
  "difficulty": "medium",
  "prompt": "查询重点植株 P15 当前生育阶段、最近一次 F2DMAS 几何版本、株高变化和关联表型记录。",
  "annotation_version": "v2",
  "review_status": "pending",
  "initial_state": {
    "objects": [
      {
        "id": "P15",
        "type": "Plant",
        "row": "Row3",
        "variety": "Tomato-Gin",
        "stage": "fruit_setting",
        "height_cm": 138.5,
        "f2dmas_version": "v2.1.3",
        "created": "2026-06-01T08:00:00+08:00"
      }
    ],
    "timeseries_records": [
      {
        "record_id": "rec-P15-h-20260701",
        "object_id": "P15",
        "metric": "height_cm",
        "timestamp": "2026-07-01T08:00:00+08:00",
        "value": 131.2
      },
      {
        "record_id": "rec-P15-h-20260704",
        "object_id": "P15",
        "metric": "height_cm",
        "timestamp": "2026-07-04T08:00:00+08:00",
        "value": 135.0
      },
      {
        "record_id": "rec-P15-h-20260707",
        "object_id": "P15",
        "metric": "height_cm",
        "timestamp": "2026-07-07T08:00:00+08:00",
        "value": 138.5
      },
      {
        "record_id": "rec-P15-stem-20260707",
        "object_id": "P15",
        "metric": "stem_diam_mm",
        "timestamp": "2026-07-07T08:00:00+08:00",
        "value": 12.4
      }
    ],
    "events": [
      {
        "event_id": "evt-P15-pheno-001",
        "object_id": "P15",
        "event_type": "stage_change",
        "timestamp": "2026-07-05T09:00:00+08:00",
        "payload": {
          "from": "flowering",
          "to": "fruit_setting"
        }
      }
    ],
    "traits": [
      {
        "trait_id": "trait-P15-01",
        "object_id": "P15",
        "trait": "fruit_brix",
        "value": 4.8,
        "unit": "brix",
        "measured_at": "2026-07-06T10:00:00+08:00"
      },
      {
        "trait_id": "trait-P15-02",
        "object_id": "P15",
        "trait": "leaf_count",
        "value": 17,
        "unit": "count",
        "measured_at": "2026-07-06T10:00:00+08:00"
      }
    ],
    "daily_reports": []
  },
  "query_spec": {
    "target_object_ids": [
      "P15"
    ],
    "metrics": [
      "height_cm",
      "stem_diam_mm"
    ],
    "start_time": "2026-07-01T00:00:00+08:00",
    "end_time": "2026-07-07T23:59:59+08:00",
    "aggregations": [
      "latest",
      "change"
    ],
    "required_units": {
      "height_cm": "cm",
      "stem_diam_mm": "mm"
    }
  },
  "expected_answer": {
    "normalized_values": {
      "height_cm": {
        "latest": 138.5,
        "change": 7.3,
        "unit": "cm"
      },
      "stem_diam_mm": {
        "latest": 12.4,
        "unit": "mm"
      }
    },
    "events": [
      {
        "event_id": "evt-P15-pheno-001",
        "object_id": "P15",
        "event_type": "stage_change",
        "timestamp": "2026-07-05T09:00:00+08:00",
        "payload": {
          "from": "flowering",
          "to": "fruit_setting"
        }
      }
    ],
    "summary_facts": [
      "stage=fruit_setting",
      "f2dmas=v2.1.3",
      "traits: 2 recorded"
    ]
  },
  "expected_evidence": {
    "record_ids": [
      "rec-P15-h-20260701",
      "rec-P15-h-20260704",
      "rec-P15-h-20260707",
      "rec-P15-stem-20260707"
    ],
    "event_ids": [
      "evt-P15-pheno-001"
    ]
  },
  "expected_outcome": {
    "answer": {
      "normalized_values": {
        "height_cm": {
          "mean": 134.9,
          "min": 131.2,
          "max": 138.5,
          "latest": 138.5,
          "unit": ""
        },
        "stem_diam_mm": {
          "mean": 12.4,
          "min": 12.4,
          "max": 12.4,
          "latest": 12.4,
          "unit": ""
        }
      },
      "events": [
        {
          "event_id": "evt-P15-pheno-001",
          "object_id": "P15",
          "event_type": "stage_change",
          "timestamp": "2026-07-05T09:00:00+08:00",
          "payload": {
            "from": "flowering",
            "to": "fruit_setting"
          }
        }
      ],
      "summary_facts": [
        "1 alert events in window [2026-07-01T00:00:00+08:00, 2026-07-07T23:59:59+08:00]"
      ]
    },
    "evidence": {
      "record_ids": [
        "rec-P15-h-20260701",
        "rec-P15-h-20260704",
        "rec-P15-h-20260707",
        "rec-P15-stem-20260707"
      ],
      "event_ids": [
        "evt-P15-pheno-001"
      ]
    }
  },
  "fatal_constraints": [],
  "allowed_side_effects": [],
  "forbidden_side_effects": [
    "create_scene",
    "add_object",
    "delete_object",
    "modify_timeseries",
    "invent_record"
  ],
  "critical_objects": [],
  "required_nodes": [],
  "required_edges": [],
  "required_bindings": [],
  "equivalence_groups": [],
  "allowed_variants": []
}